Organization Name,callisto url,website,logo,expected number of hires,numeber of employees,Organization Type,Organization Description,Job/Internship Description,Position Locations,Position Types,Days Attending,10gen (the MongoDB company),https://berkeley-csm.symplicity.com/students/?s=employers&ss=employers&mode…4349e14600feae7b871fa8f3d4074584&cfc=3818f66115449b96b310baf0b989830b&sss=,,,,,Computer Software,"10gen is the company behind MongoDB, the leading NoSQL database. MongoDB is the open-source, document-oriented database that is quickly reshaping the overall database and big data market due to the popularity of its agile and scalable approach among developers and IT professionals for new applications in the cloud and beyond. To date, we've raised over $80M. Last year we doubled in size while revenue grew 4x. As one of the most popular new technologies, MongoDB has more than 4 million downloads, 50,000 Online Education registrations, 15,000 MongoDB User Group (MUG) members, 14,000 MongoDB Monitoring Service users and 10,000 attendees at MongoDB global events in 2012. We have offices in New York City, and Silicon Valley with a worldwide presence.",Summer Engineering Intern New Grad Software Engineer,"New York, New York & Palo Alto, CA","Paid, Full-time, Summer Job, Internship","Cal Career Fair Day 2 - 9/18/13, Engineering/Science Opportunities",
247 Customer Inc,https://berkeley-csm.symplicity.com/students/?s=employers&ss=employers&mode…1471fcc8e7051de869625c47c063ae8e&cfc=3818f66115449b96b310baf0b989830b&sss=,,,,,"Professional, Technical, and Administrative Services, Computer Software, Consumer Products, Telecommunications, Engineering","[24]7, provides intuitive customer experience through mobile, speech, chat and web channels to make life simple for consumers to connect with companies to get things done",,"Unites States, Campbell CA, Alameda CA","Part-time, Full-time, Internship","Cal Career Fair Day 2 - 9/18/13, Engineering/Science Opportunities",2H Offshore Inc,https://berkeley-csm.symplicity.com/students/?s=employers&ss=employers&mode…f0fc87bd273dbc8383eac16cce231faa&cfc=3818f66115449b96b310baf0b989830b&sss=,,,,,Engineering,"2H Offshore is a global engineering contractor specializing in the design, structural analysis and integrity management of riser and conductor systems used in the drilling and production of offshore oil and gas reserves. With offices around the world, the most experienced riser engineers and by employing industry leading processes, we aim to provide the 'best in class' service to our customers. 2H Offshore is an Acteon group company.","The challenges involved in designing deepwater risers are considerable and require the application of cutting edge technology. We are seeking bright, talented individuals who can rise to this challenge and help us apply new ideas to real life industry problems. In return, we are committed to providing employees with continued training and development and rapid career progression in this exciting field.","Houston, Texas","Full-time, Internship","Cal Career Fair Day 2 - 9/18/13, Engineering/Science Opportunities",ABS,https://berkeley-csm.symplicity.com/students/?s=employers&ss=employers&mode…9670d4055d538bc3082a53bdc7eb95ee&cfc=3818f66115449b96b310baf0b989830b&sss=,,,,,,,,,"Cal Career Fair Day 3 - 9/19/13, All Opportunities (Tech & Nontech)",,Accenture,https://berkeley-csm.symplicity.com/students/?s=employers&ss=employers&mode…b45e15b9e5781573e190d55132c94748&cfc=3818f66115449b96b310baf0b989830b&sss=,,,,,"Professional, Technical, and Administrative Services","Accenture Systems Integration Consulting Analyst You’ve worked hard for your degree. Now put your degree to work with an organization that offers greater opportunity, greater challenge and greater satisfaction. Be at the forefront of technology innovation with a career with Accenture. As a Systems Integration Consulting analyst you will combine cutting-edge technology with advanced business thinking. Accenture is a world leader in systems integration, with more than 30 years of experience and a proven track record of transformational projects. Our systems integration professionals draw on deep technology skills, functional experience and industry knowledge. Join our team and design and deliver IT systems that create value and support the goals of our global business clients.","Accenture Systems Integration Consulting Analyst You’ve worked hard for your degree. Now put your degree to work with an organization that offers greater opportunity, greater challenge and greater satisfaction. Be at the forefront of technology innovation with a career with Accenture. As a Systems Integration Consulting analyst you will combine cutting-edge technology with advanced business thinking. Accenture is a world leader in systems integration, with more than 30 years of experience and a proven track record of transformational projects. Our systems integration professionals draw on deep technology skills, functional experience and industry knowledge. Join our team and design and deliver IT systems that create value and support the goals of our global business clients.",Nationwide in select cities,Full-time,"Cal Career Fair Day 2 - 9/18/13, Engineering/Science Opportunities","Acumen, LLC",https://berkeley-csm.symplicity.com/students/?s=employers&ss=employers&mode…a81b8733a3951b06ad5632c10a6b07d5&cfc=3818f66115449b96b310baf0b989830b&sss=,,,,,Other,"Acumen, LLC / The SPHERE Institute conduct public policy research and statistical analysis on health programs at the national, state, and local levels. We leverage our unparalleled data access to improve information available to policymakers, while our meritocratic environment offers rapid advancement and leadership opportunities. Our policy firms offer an exciting opportunity to work in health care topics.",,"Burlingame, CA; Washington DC",Full-time,"Cal Career Fair Day 3 - 9/19/13, All Opportunities (Tech & Nontech)",ADP (Automatic Data Processing),https://berkeley-csm.symplicity.com/students/?s=employers&ss=employers&mode…dd9a1c2493580ed0796f5c8cd97856f8&cfc=3818f66115449b96b310baf0b989830b&sss=,,,,,Diversified Services,"About ADP: We power organizations with insightful solutions that drive business success. Consistently named one of the ""Most Admired Companies"" by FORTUNE® Magazine, and recognized by Forbes® as one of “The World’s Most Innovative Companies,” ADP has over a half-million clients around the globe and 60+ years of experience as a world-wide leader of business outsourcing solutions. Technology at ADP. It's the foundation of the products and services that have made us a world-wide leader in workforce solutions. With us, you can combine technical skills and business acumen, to effectively consult as well as solve technical challenges. You have the opportunity to train on leading-edge technologies that continually redefine what's possible in our industry.","This is a high-growth position in engineering the next generation of enterprise class software solutions at ADP. You will obtain hands-on technical experience, a rewarding career path and work with team members in the early & continuous delivery of high quality software products. Interns must be a college junior or senior and have a passion for technology. About ADP: We power organizations with insightful solutions that drive business success. Consistently named one of the ""Most Admired Companies"" by FORTUNE® Magazine, and recognized by Forbes® as one of ""The World's Most Innovative Companies,"" ADP has over a half-million clients around the globe and 60+ years of experience as a world-wide leader of business outsourcing solutions.","Redwood City, California",Internship,"Cal Career Fair Day 2 - 9/18/13, Engineering/Science Opportunities",Alpine Data Labs,https://berkeley-csm.symplicity.com/students/?s=employers&ss=employers&mode…ee80500a009a49eec857d1334b23255b&cfc=3818f66115449b96b310baf0b989830b&sss=,,,,,Computer Software,"Alpine Data Labs makes data science on Big Data accessible to everyone. We have simplified popular machine-learning methods and made them available on petabyte-scale datasets. Our lightweight web application does this by leveraging the parallel processing power of Hadoop and MPP databases. We deliver on the promise of Hadoop and Big Data, by providing a collaborative and intuitive visual environment for teams to quickly create and deploy analytics workflows and predictive models.","Senior Software Engineer Senior QA Engineer UI/Web Engineer Algorithms Engineer Data Scientist, Client Services Solution Architect, Client Services Technical Support Engineer Product Trainer",United States,"Paid, Full-time, Internship","Cal Career Fair Day 2 - 9/18/13, Engineering/Science Opportunities",Altera Corporation,https://berkeley-csm.symplicity.com/students/?s=employers&ss=employers&mode…e6cfc3a0ab1b86d8be835c9acd166ff5&cfc=3818f66115449b96b310baf0b989830b&sss=,,,,,"Computer Hardware, Computer Software, Electronics and Misc. Tech","Altera Corporation (NASDAQ: ALTR) is the pioneer of programmable logic solutions, enabling system and semiconductor companies to rapidly and cost effectively innovate, differentiate, and win in their markets. Altera offers FPGAs, SoCs with embedded processor systems, CPLDs, and ASICs in combination with software tools, intellectual property, embedded processors and customer support to provide high-value programmable solutions to over 16,000 customers worldwide. Altera was founded in 1983 and had annual revenues in 2012 of US$1.8 billion. Altera is headquartered in San Jose, California, and employs more than 3,000 people in over 20 countries.","Altera's cutting edge FPGAs & HardCopy ASICs require increasingly complex software. You are a Software/Hardware Engineer who wants to build key components of this software, are excited by learning about new technologies, & are motivated by being part of a team that is critical to the success of Altera. The successful candidate's minimum qualifications will include the following: • BS in CE, EE, CS or equivalent • Strong understanding of RTL coding principles including proficiency in Verilog/VHDL • Proficiency in scripting languages (Perl, TCL) • Extensive experience with large code bases in C &/or C++, (Python and/or Java) • Knowledge of object-oriented programming, data structures & algorithms • Strong background in data-structure & algorithm implementation in C/C++","San Jose, CA",Full-time,"Cal Career Fair Day 2 - 9/18/13, Engineering/Science Opportunities",Altria Group,https://berkeley-csm.symplicity.com/students/?s=employers&ss=employers&mode…f2d506d147f4d487e284e12eb675648d&cfc=3818f66115449b96b310baf0b989830b&sss=,,,,,Consumer Products,"Altria Group is the parent company for Philip Morris USA, John Middleton, U.S. Smokeless Tobacco Company, and Ste. Michele Wine Estates. This fortune 200 company owns such leading tobacco brands as Marlboro, Copenhagen, Skoal, and Black & Mild. In addition to these brands, Altria also owns an investment branch with ownership stakes in such companies as Nu Mark and SAB Miller. This year in Money Magazine, Altria ranked #4 amongst the world's most admired companies for social responsibility and #10 for financial soundness.","Paid Internship - Our 10 week summer internships are created to offer students real world work experiences. There’s no coffee making or copy errands here. Designed to give students a true glimpse into the life of a territory sales manager, the summer internships empower students to take control of the internship and make real decisions that impact our business. Students engage with retail business owners, offering financial and marketing solutions to everyday problems. Full Time -The territory sales manager position offers professionals the opportunity to manage a territory that produces an average of $15MM in company revenues. Given a wide range of retail and wholesale businesses, our territory sales managers consult with business owners to produce strategic solutions.",Northern California,"Full-time, Internship","Cal Career Fair Day 1 - 9/17/13, Business/Public Service Opportunities",Alvarez & Marsal (A&M),https://berkeley-csm.symplicity.com/students/?s=employers&ss=employers&mode…76fd24870d34515356384e2a1aa43f43&cfc=3818f66115449b96b310baf0b989830b&sss=,,,,,"Professional, Technical, and Administrative Services","For nearly three decades, Alvarez & Marsal has set the standard for working with organizations to tackle complex business issues, boost operating performance and maximize stakeholder value. As a leading, independent global professional services firm, Alvarez & Marsal (A&M) has been owner-operated and privately held since inception, therefore, putting the needs of businesses and their investors first – without competing interests and free of audit-based conflicts. A&M is a different kind of firm. Lean, fast-paced and entrepreneurial to the core, we pride ourselves on building a culture of independent thinkers and doers – individuals who will make a difference to the clients they serve and be justly rewarded for performance.","Alvarez & Marsal is seeking exceptional individuals with outstanding capabilities and an impressive record of accomplishment. A&M Consultants work with and lead client management and executives to deliver sustainable results that positively impact bottom line corporate performance. Consultants will be expected to assist in project planning, solution design, and realization of expected results. A&M Consultants must be able to meet deadlines, handle multiple tasks concurrently, work effectively independently or as part of a team, adapt to new assignments, and manage others as required. Since A&M deploys in relatively small teams, Consultants are expected to be capable of developing and executing against fast moving, high impact project plans. Travel is expected.","San Francisco, CA",Full-time,"Cal Career Fair Day 1 - 9/17/13, Business/Public Service Opportunities",Ancestry.com,https://berkeley-csm.symplicity.com/students/?s=employers&ss=employers&mode…1774c66a288be526cd3ce8fa88f627d5&cfc=3818f66115449b96b310baf0b989830b&sss=,,,,,Computer Software,"Ancestry.com is a profitable, growing company with a positive, high-energy environment. Together, our dedicated teams are harnessing the power of technology and using it to simplify the way people connect with their families and their unique legacies. Our work environment is fast-paced and challenging, but also extremely exciting. You’ll work with a team of passionate, engaged individuals. We offer excellent benefits and a competitive compensation package. For additional information, regarding our benefits and career information, please visit our website at http://ancestry.com/careers.",,"San Francisco, CA or Provo, UT","Paid, Part-time, Summer Job, Internship","Cal Career Fair Day 2 - 9/18/13, Engineering/Science Opportunities",Angie's List,https://berkeley-csm.symplicity.com/students/?s=employers&ss=employers&mode…a72633b1aad06af74d74c5073f73fffc&cfc=3818f66115449b96b310baf0b989830b&sss=,,,,,"Computer Software, Consumer Products","What is Angie’s List? Plumbers, exterminators, carpenters, electricians, dry cleaners, auto repair, doctors… Angie’s List is a consumer-driven organization that collects customer satisfaction ratings on local service companies in more than 550 categories. We provide an exclusive list of these companies based on feedback from local consumers who know who to turn to when the gray clouds of disrepair loom. It’s the word-of-mouth network solidified into one handy “who can I call” list. We now have over 2,000,000 members!",,United States,"Paid, Full-time, Internship","Cal Career Fair Day 3 - 9/19/13, All Opportunities (Tech & Nontech)",Anheuser-Busch InBev,https://berkeley-csm.symplicity.com/students/?s=employers&ss=employers&mode…c8817a08b83efe35f18081535cd42bdf&cfc=3818f66115449b96b310baf0b989830b&sss=,,,,,Consumer Products,"Anheuser-Busch InBev is a publicly traded company (Euronext: ABI) based in Leuven, Belgium. It is the leading global brewer and one of the world's top five consumer products companies. A true consumer-centric, sales driven company, Anheuser-Busch InBev manages a portfolio of nearly 300 brands, including its three global brands, Budwesier, Becks, and Stella Artois. Geographically diversified with a balanced exposure to developed and developing markets, Anheuser-Busch InBev leverages the collective strengths of its 120,000 employees based in operations in over 30 countries across the world. The company strives to be the Best Beer Company in a Better World.","Global Management Trainee Overview We attract the brightest, most driven graduates and nurture talent by giving relevant experiences right from the start. Our goal is to find people who can take on challenging positions early on in their careers and set the pace for the organization as a whole. We achieve this by putting the trainees through an intensive 10-month cross-functional training program before their role. The GMT Program delivers a holistic understanding of the global beer industry and how Anheuser-Busch operates within it. Trainees gain insight into every aspect of the business by completing unique rotations within key entities. Together in teams, trainees will apply this cross-functional knowledge by designing and producing a beer prototype.",USA,Full-time,"Cal Career Fair Day 3 - 9/19/13, All Opportunities (Tech & Nontech)",Applied Materials,https://berkeley-csm.symplicity.com/students/?s=employers&ss=employers&mode…9819702c8dd14f413387d86f2ba651ae&cfc=3818f66115449b96b310baf0b989830b&sss=,,,,,Electronics and Misc. Tech,"Applied Materials, Inc. is the global leader in providing innovative equipment, services and software to enable the manufacture of advanced semiconductor, flat panel display and solar photovoltaic products. Our technologies help make innovations like smartphones, flat screen TVs and solar panels more affordable and accessible to consumers and businesses around the world.",,"Santa Clara, CA","Full-time, Internship","Cal Career Fair Day 2 - 9/18/13, Engineering/Science Opportunities",Applied Predictive Technologies,https://berkeley-csm.symplicity.com/students/?s=employers&ss=employers&mode…be593986bf6737670e38399c6b3fa6da&cfc=3818f66115449b96b310baf0b989830b&sss=,,,,,"Professional, Technical, and Administrative Services, Computer Software, Engineering","Founded in 1999, APT is a rapidly growing strategic consulting and Software-as-a-Service company with offices in Washington D.C., San Francisco, London, and Taipei. With a powerful analytic software platform at its heart, APT is revolutionizing the way Fortune 500 companies think of developing their business strategy. APT’s client portfolio boasts the world’s best known brands including Starbucks, Kraft, Staples, Lowe’s, Subway, Wells Fargo, Victoria’s Secret and the InterContinental Hotels Group. APT was featured in the Harvard Business Review for being the pioneer in bringing the principles of scientific experimentation into the business universe. Visit us at joinapt.com",,"Washington, DC",Full-time,"Cal Career Fair Day 2 - 9/18/13, Engineering/Science Opportunities",Applied Predictive Technologies,https://berkeley-csm.symplicity.com/students/?s=employers&ss=employers&mode…f1bce713b62a1a0ab04a68242b2e2437&cfc=3818f66115449b96b310baf0b989830b&sss=,,,,,"Professional, Technical, and Administrative Services, Computer Software, Engineering","Founded in 1999, APT is a rapidly growing strategic consulting and Software-as-a-Service company with offices in Washington D.C., San Francisco, London, and Taipei. With a powerful analytic software platform at its heart, APT is revolutionizing the way Fortune 500 companies think of developing their business strategy. APT’s client portfolio boasts the world’s best known brands including Starbucks, Kraft, Staples, Lowe’s, Subway, Wells Fargo, Victoria’s Secret and the InterContinental Hotels Group. APT was featured in the Harvard Business Review for being the pioneer in bringing the principles of scientific experimentation into the business universe. Visit us at joinapt.com",,"Washinton D.C., San Francisco","Full-time, Internship","Cal Career Fair Day 1 - 9/17/13, Business/Public Service Opportunities",Arista Networks,https://berkeley-csm.symplicity.com/students/?s=employers&ss=employers&mode…c405b0cfeb573eda8dbeff4742ca0e01&cfc=3818f66115449b96b310baf0b989830b&sss=,,,,,Computer Hardware,"Arista delivers Cloud Networking solutions for large datacenter and computing environments. Arista builds and sells 10/40/100 gigabit ethernet switches with outstanding scalability, robustness, and price-performance. At the core of Arista's platform is EOS™ , a pioneering open, extensible, fault-tolerant software architecture. Arista's team is built of experienced management and engineering talent from leading networking companies and universities.","Software Engineer: Build the software at the heart of our product. Hardware Engineer: Build the fastest, densest, and coolest networking hardware in the world. Platform Engineer: Work on convergence of platforms and software engineering and bring a hybrid of hardware and software skills to Arista EOS and platforms.",San Francisco and Santa Clara,"Full-time, Summer Job, Internship","Cal Career Fair Day 2 - 9/18/13, Engineering/Science Opportunities",Arizona Public Service- Palo Verde Nuclear Generating Station,https://berkeley-csm.symplicity.com/students/?s=employers&ss=employers&mode…98b6067681d384f98bf434c4cedb7cf7&cfc=3818f66115449b96b310baf0b989830b&sss=,,,,,Utilities,"As Arizona’s largest and longest-serving electric company, we’re proud of our heritage and past performance. But we recognize new technologies and growing customer expectations are leading to rapid changes at our company and in our industry. We generate safe, affordable and reliable electricity for more than 1.1 million retail and residential customers in 11 of Arizona’s 15 counties. By 2030 we expect to add 750,000 new customers, an increase of more than 65%. We plan to meet those customers’ needs through innovation and excellent service.",,Phoenix,"Paid, Full-time, Internship","Cal Career Fair Day 2 - 9/18/13, Engineering/Science Opportunities",Ask.com,https://berkeley-csm.symplicity.com/students/?s=employers&ss=employers&mode…4b9e0e97ce542f9a8005903cb30cfc44&cfc=3818f66115449b96b310baf0b989830b&sss=,,,,,Engineering,"Headquartered in Oakland, California with an international presence in the UK and Europe, Ask.com is the fourth biggest site on the web when it comes to monthly searches, and attracts more than 100 million unique users globally. Ask.com is a wholly owned business of IAC (Nasdaq: IACI).",,"Oakland, CA","Paid, Full-time, Internship","Cal Career Fair Day 3 - 9/19/13, All Opportunities (Tech & Nontech)",AT&T,https://berkeley-csm.symplicity.com/students/?s=employers&ss=employers&mode…3d47c1f8ad0e7e8b1d8445017091bdeb&cfc=3818f66115449b96b310baf0b989830b&sss=,,,,,"Professional, Technical, and Administrative Services, Computer Software, Telecommunications, Engineering","AT&T is seeking candidates for a highly unique opportunity in the field of Computer Science and Engineering. The opportunity is to participate as a member of a small team with a simple objective. Innovate! We are assembling teams to drive new and innovative ideas to our business units. The teams will consist of Subject Matter Experts, Data Scientist, Business Analysts and other roles, resources and tools the team deems necessary for success.",,United States,"Paid, Full-time, Summer Job","Cal Career Fair Day 2 - 9/18/13, Engineering/Science Opportunities",Becton Dickinson,https://berkeley-csm.symplicity.com/students/?s=employers&ss=employers&mode…2d009ded3379d04ff3da0f40ccc85357&cfc=3818f66115449b96b310baf0b989830b&sss=,,,,,"Biotech/Pharmaceuticals, Health Products and Services","BD is a medical technology company that serves healthcare institutions, life science researchers, clinical laboratories, industry and the general public. BD manufactures and sells a broad range of medical supplies, devices, laboratory equipment and diagnostic products. BD is headquartered in the United States and has offices in more than 50 countries worldwide.","BD (Becton, Dickinson and Company), a leading global medical technology company, is seeking high-potential technical talent for its Technology Leadership Development Program (TLDP). The TLDP’s vision is to develop future leaders of BD’s R&D organization, by providing TLDP associates with broad and deep technical assignments across BD. The program consists of three successively more challenging assignments which can span multiple businesses and/or locations within the company, strengthening the technical depth and skills of these high-potential associates while developing their leadership skills and stretching them across multiple disciplines. A personalized and dynamic career path is sculpted for each individual TLDP, based on your personal skills and interests.",United States,"Paid, Full-time","Cal Career Fair Day 2 - 9/18/13, Engineering/Science Opportunities",BEGHOU CONSULTING,https://berkeley-csm.symplicity.com/students/?s=employers&ss=employers&mode…86f9515b4fa84289a4c05e2040e937d3&cfc=3818f66115449b96b310baf0b989830b&sss=,,,,,,,,,"Cal Career Fair Day 3 - 9/19/13, All Opportunities (Tech & Nontech)",,