Consumer Financial Protection Bureau,https://berkeley-csm.symplicity.com/students/?s=employers&ss=employers&mode…913585be7d46ad40bf56207d4b4a3643&cfc=3818f66115449b96b310baf0b989830b&sss=,,,,,Government,"Our mission is to make markets for consumer financial products and services work for Americans — whether they are applying for a mortgage, choosing among credit cards, or using any number of other consumer financial products.",,"Nationwide, Washington DC","Full-time, Internship","Cal Career Fair Day 1 - 9/17/13, Business/Public Service Opportunities",Contact Singapore,https://berkeley-csm.symplicity.com/students/?s=employers&ss=employers&mode…fc2ea87879e6f1d0c2816f0694da727c&cfc=3818f66115449b96b310baf0b989830b&sss=,,,,,Government,"Contact Singapore is an alliance of the Singapore Economic Development Board and Ministry of Manpower. We engage overseas Singaporeans and global talent to work, invest and live in Singapore. Contact Singapore actively links Singapore-based employers with professionals to support the growth of our key industries. We work with investors to realise their business and investment interests in Singapore. For information on working, investing and living in Singapore, please visit www.contactsingapore.sg or contact our worldwide offices. For the latest career opportunities, please visit the Contact Singapore Job Portal www.contactsingapore.sg/jobs For queries, please contact Ms Parveen Kaur or Ms Suzie Chiang at sanfrancisco@contactsingapore.sg",You can find the latest career opportunities in Singapore by visiting the Contact Singapore Job Portal at www.contactsingapore.sg/jobs,Singapore,Full-time,"Cal Career Fair Day 3 - 9/19/13, All Opportunities (Tech & Nontech)",Cornerstone Research,https://berkeley-csm.symplicity.com/students/?s=employers&ss=employers&mode…2dedd3ea78248c1b2c3e7b38e0597157&cfc=3818f66115449b96b310baf0b989830b&sss=,,,,,Other,"Cornerstone Research is a consulting firm specializing in the analysis of complex financial, economic, accounting, and marketing issues. In recent years, Cornerstone Research has become one of the nation’s leading finance and economics consulting firms with more than 450 full-time staff members across seven offices. Cornerstone Research has consulted on a wide variety of projects involving numerous industries. Our clients include major securities firms, top consulting and other professional service firms, leading pharmaceutical companies, major participants in energy markets, over one hundred Internet and other high-technology firms, and large telecommunications providers. Our consultants employ innovative problem solving approaches and achieve unparalleled analytic depth.",,"San Francisco, CA; Menlo Park, CA",Full-time,"Cal Career Fair Day 1 - 9/17/13, Business/Public Service Opportunities","Coverity, Inc.",https://berkeley-csm.symplicity.com/students/?s=employers&ss=employers&mode…abec4e43095e8033d16e8c5c76abb000&cfc=3818f66115449b96b310baf0b989830b&sss=,,,,,Computer Software,"You may not have heard of us, but we're involved in every aspect of your life. Software defects create very real and material issues. Coverity's mission is to change the way software is developed. We do this by creating precision software analysis to help customers build high integrity software faster and cheaper. Coverity is the market leader for analysis products that find and eliminate defects in software code. Over 100,000 commercial and open source developers use Coverity to deliver software free of crash-causing bugs and security problems. We were in your cell phone, your gaming software, your internet search engine, and your x-ray machine long before you got there. We've been quietly providing material value to the entire software consumer universe.",,"San Francisco, CA; Seattle, WA","Full-time, Internship","Cal Career Fair Day 2 - 9/18/13, Engineering/Science Opportunities",creativeLIVE,https://berkeley-csm.symplicity.com/students/?s=employers&ss=employers&mode…a90fe7146d6144c8ce93d9f2cbf567fa&cfc=3818f66115449b96b310baf0b989830b&sss=,,,,,Education/Higher Education,"creativeLIVE is the world’s leading live, online classroom for creative entrepreneurs. Using a scalable, freemium model, creativeLIVE is transforming the $100B continuing education market by offering frictionless access to the best teachers in the world via a social video platform. The company was founded in April 2010 by world-renowned photographer, director, and artist Chase Jarvis and entrepreneur Craig Swanson and has been profitable since day one. The company is led by CEO Mika Salmi, backed by Greylock Partners and has locations in Seattle and San Francisco. http://www.creativelive.com/about","Full Stack Software Engineer- We are looking for Javascript enthusiasts who want to work in server side Javascript. Our tech stack is is a heavy open source stack including node.js, Express, Bootstrap and MongoDB just to name a few. Front End Engineer- We are looking for someone who loves to work with HTML, CSS and JavaScript, and has a never-ending appetite for learning new things. Line Producer- We are looking for a talented Line Producer to join our team as our production schedule continues to increase. Our Producers work at a rigorous pace to ensure workshops are produced and delivered to the highest quality. Production Coordinator- We are looking for someone support the Producers, Instructors, Production team and guests from pre to post production.",San Francisco,Full-time,"Cal Career Fair Day 3 - 9/19/13, All Opportunities (Tech & Nontech)",Crowe Horwath LLP,https://berkeley-csm.symplicity.com/students/?s=employers&ss=employers&mode…d9ae21efb1351a5c65b49af292f38db3&cfc=3818f66115449b96b310baf0b989830b&sss=,,,,,Accounting Services,"Crowe Horwath LLP (www.crowehorwath.com) is one of the largest public accounting and consulting firms in the United States. Under its core purpose of “Building Value with Values®,” Crowe uses its deep industry expertise to provide audit services to public and private entities, while also helping clients reach their goals with tax, advisory, risk and performance services. With offices coast to coast and 2,600 personnel, Crowe is recognized by many organizations as one of the country's best places to work. Crowe serves clients worldwide as an independent member of Crowe Horwath International, one of the largest global accounting networks in the world, consisting of more than 150 independent accounting and advisory services firms in more than 100 countries around the world.",,San Francisco,"Full-time, Internship","Cal Career Fair Day 3 - 9/19/13, All Opportunities (Tech & Nontech)",CSAA Insurance Group,https://berkeley-csm.symplicity.com/students/?s=employers&ss=employers&mode…db561d76bea30682e0544f7b7453759c&cfc=3818f66115449b96b310baf0b989830b&sss=,,,,,Insurance,"CSAA Insurance Group offers reliable auto, home and other personal lines of insurance to AAA Members, in partnership with local AAA clubs in 23 states and the District of Columbia. With 2.3 million policies in place and $2.7 billion in revenue (2011), we are one of the nation's largest providers of personal lines of insurance. Our company is rated ""A+"" by A.M. Best, the insurance industry's most respected ratings agency. We have also been a member of the Better Business Bureau for 80 years.",,"Walnut Creek, CA","Paid, Full-time, Internship","Cal Career Fair Day 1 - 9/17/13, Business/Public Service Opportunities","Cutler Group, LP",https://berkeley-csm.symplicity.com/students/?s=employers&ss=employers&mode…9f1fe66eb6c658576c8ba006c1e04fef&cfc=3818f66115449b96b310baf0b989830b&sss=,,,,,Financial Services,"Founded in 1994, Cutler Group is a sophisticated derivatives trading firm focused primarily on equity options. Our trading strategy is to employ probability based logic with proprietary valuation models and leading edge technology to gain a competitive advantage in providing liquidity to the marketplace, and in exploiting market inefficiencies. Our longer term goals include applying our analytical and trading expertise to a variety of derivatives markets worldwide, and creating best-in-class proprietary trading technology in order to make optimal automated trading decisions.","Quantitative Trading Intern – Winter 2013/Summer 2014 •Analyze intraday volatility trends, financial news, and options order flow to support traders •Research individual companies, sector groups, or cross-product relationships to identify volatility catalysts and arbitrage opportunities •Create/evaluate volatility trading strategies using quantitative and fundamental analysis •Generate reports/build analytical tools to support trading operations •Monitor risk, reconcile trades, and liaise with traders, brokers, and back-office personnel •Formal training program covers a broad range of topics, including options theory, market structure, and risk management. You will be evaluated based on your performance; successful interns may be offered a full-time Trading Associate position.","San Francisco, CA","Paid, Full-time, Internship","Cal Career Fair Day 2 - 9/18/13, Engineering/Science Opportunities",D. E. Shaw & Co.,https://berkeley-csm.symplicity.com/students/?s=employers&ss=employers&mode…2b99f4cccfa9353feffb6eaf4c26fff0&cfc=3818f66115449b96b310baf0b989830b&sss=,,,,,"Computer Software, Financial Services","Headquartered in New York City, the D. E. Shaw group is a global investment and technology development firm with offices in North America, Europe, and Asia. Since its organization in 1988 by a former Columbia University computer science professor, David E. Shaw, the firm has earned an international reputation for successful investing based on financial innovation, careful risk management, and the quality and depth of our staff. Our investment activities are based on both mathematical models and our staff’s expertise, and our multi-disciplinary approach combines insights from quantitative fields, software development, sector expertise, and finance.",Quantitative Analyst Software Developer Junior Proprietary Trader,"New York, NY","Paid, Full-time, Internship","Cal Career Fair Day 2 - 9/18/13, Engineering/Science Opportunities",D. E. Shaw Research,https://berkeley-csm.symplicity.com/students/?s=employers&ss=employers&mode…f6fd9cdeb0dda4b3893240c0d52c644c&cfc=3818f66115449b96b310baf0b989830b&sss=,,,,,"Biotech/Pharmaceuticals, Computer Hardware, Computer Software, Electronics and Misc. Tech, Engineering","D. E. Shaw Research (""DESRES"") is an independent research laboratory that conducts basic scientific research in the field of computational biochemistry under the direct scientific leadership of Dr. David E. Shaw. DESRES is currently focusing primarily on molecular simulations involving proteins and other biological macromolecules of potential interest from both a scientific and a pharmaceutical perspective. The group includes computational chemists and biologists, computer scientists and applied mathematicians, and computer architects and engineers, all working collaboratively within a tightly coupled interdisciplinary research environment.We are seeking exceptional candidates, and are prepared to offer a highly attractive compensation package for all positions.",,New York,"Paid, Fellowship, Full-time, Internship","Cal Career Fair Day 3 - 9/19/13, All Opportunities (Tech & Nontech)","DaVita, Inc.",https://berkeley-csm.symplicity.com/students/?s=employers&ss=employers&mode…254feec31cbd8908dc625b790c99b446&cfc=3818f66115449b96b310baf0b989830b&sss=,,,,,"Health Products and Services, Hospital/Healthcare","DaVita is the dialysis division of DaVita HealthCare Partners Inc., a Fortune 500® company that, through its operating divisions, provides a variety of health care services to patient populations throughout the United States and abroad. As of March 31, 2013, DaVita operated or provided administrative services at 1,991 outpatient dialysis centers located in the United States serving approximately 156,000 patients. The company also operated 41 outpatient dialysis centers located in five countries outside the United States. DaVita supports numerous programs dedicated to creating positive, sustainable change in communities around the world. The company’s leadership development initiatives and social responsibility efforts have been recognized by Fortune, Modern Healthcare, Newsweek and WorldBl","DaVita is invested in your professional and personal development. The Redwoods Analyst Development Program begins in September of 2014 and is structured around professional and personal growth with a strong focus on the development of analytical, strategic and entrepreneurial skills. Redwoods Analysts benefit from our robust mentorship program. During their first year, a mixture of classroom and experiential training is offered as well as exposure to several departments around the company. •Demonstrated leadership potential •Strong analytical/financial skills •Highly skilled in problem solving & critical thinking •Ability to multi-task & prioritize •Excellent teamwork & interpersonal skills •Outstanding verbal & written communication skills •Alignment with DaVita’s mission & values","Denver, Los Angeles, San Francisco, Dallas",Full-time,"Cal Career Fair Day 1 - 9/17/13, Business/Public Service Opportunities",Deloitte Consulting LLP,https://berkeley-csm.symplicity.com/students/?s=employers&ss=employers&mode…487ef17d45f448f4f699d34b63e522b3&cfc=3818f66115449b96b310baf0b989830b&sss=,,,,,Other,"Deloitte Consulting LLP is one of the world's leading consulting firms for business strategy, operations, technology, and human resources planning. We bring together a unique experience, scale, and capabilities to help clients address their most complex business problems. Our unique organizational structure and our collaborative approach integrate consulting with tax solutions, financial advisory services, and risk management capabilities. Clients depend on us for straightforward advice and results that create value. With nearly 7000 Deloitte Consulting LLP employees in more than 80 U.S. cities, we understand that people are our most precious resource. We also know that serving our clients and helping them and our people excel demands a diverse range of skills.",,Nationwide,"Paid, Full-time","Cal Career Fair Day 1 - 9/17/13, Business/Public Service Opportunities",Dropbox,https://berkeley-csm.symplicity.com/students/?s=employers&ss=employers&mode…bac6579f6c3149c175e2e15302ced83b&cfc=3818f66115449b96b310baf0b989830b&sss=,,,,,Computer Software,"Dropbox is a San Francisco-based tech company focused on making it easier for people to access and share their stuff. We're building a seamless experience across desktops, browsers, smartphones, tablets, and more, all the while reliably processing over a billion files per day, totaling hundreds of terabytes. With over 175 million users, but just about 100 engineers, we're looking to expand our world-class team.",,San Francisco,"Paid, Full-time, Summer Job, Internship","Cal Career Fair Day 3 - 9/19/13, All Opportunities (Tech & Nontech)",Drug Enforcement Administration (DEA),https://berkeley-csm.symplicity.com/students/?s=employers&ss=employers&mode…48721a2b747a3161b5c235462e807bb5&cfc=3818f66115449b96b310baf0b989830b&sss=,,,,,Government,"The Drug Enforcement Administration (DEA) is responsible for enforcing the Federal Narcotics Laws. DEA is considered the lead drug enforcement agency within the United States and in over 80 foreign posts. DEA Special Agents conduct criminal and financial investigations targeting drug trafficking organizations that operate in the United States and worldwide. Duties include utilizing arrest/surveillance/undercover techniques, providing sworn testimony in Federal/State/Foreign courts, and writing highly detailed and technical reports. DEA Special Agents will enjoy an exciting rewarding career with opportunities for advancement and world travel.",,Nationwide,Full-time,"Cal Career Fair Day 1 - 9/17/13, Business/Public Service Opportunities","Duff and Phelps, LLC",https://berkeley-csm.symplicity.com/students/?s=employers&ss=employers&mode…9513ddba1a9ea311aec0461fea5f8aa7&cfc=3818f66115449b96b310baf0b989830b&sss=,,,,,"Financial Services, Real Estate","POWERING SOUND DECISIONS At Duff & Phelps, we stand for the qualities that power sound decisions. And we believe that behind every good decision, you'll find solid thinking, proven experience and valuable insight. But all the numbers and facts in the world mean nothing without a top team of professionals to make sense of them all. That's where YOU come in - provided you're incisive, entrepreneurial and up for a challenge. We offer an environment where your talent and perspective matter - where you can make a real impact. Join our team and together we'll power the sound decisions that enhance value - yours and ours. Duff & Phelps Financial Advisory & Investment Banking Services",,Nationwide,Full-time,"Cal Career Fair Day 1 - 9/17/13, Business/Public Service Opportunities",DuPont Industrial Biosciences,https://berkeley-csm.symplicity.com/students/?s=employers&ss=employers&mode…a85953570af13a6464b3e4d8c7bec90f&cfc=3818f66115449b96b310baf0b989830b&sss=,,,,,Biotech/Pharmaceuticals,"DuPont Industrial Biosciences comprises an unmatched portfolio of capabilities in industrial biotechnology and biobased solutions. The unique combination of agricultural, biotechnology, chemical and material science capabilities allows DuPont Industrial Biosciences to deliver cost-effective products with superior performance and sustainability aspects to a range of industries. Bringing together the expertise from Danisco, Genencor, and DuPont has yielded a unique combination of strengths in enzyme technology, materials science, and bioprocessing. We call it Powered by DuPont™ Genencor® Science. It’s what powers the innovations to help solve some of the world’s greatest challenges.",,United States,"Paid, Full-time, Internship","Cal Career Fair Day 2 - 9/18/13, Engineering/Science Opportunities",E. & J. Gallo Winery,https://berkeley-csm.symplicity.com/students/?s=employers&ss=employers&mode…123f34fcfde71178ae23301c7f7670de&cfc=3818f66115449b96b310baf0b989830b&sss=,,,,,Consumer Products,"E. & J. Gallo Winery arose over 75 years ago from humble beginnings by brothers Ernest and Julio Gallo. Today, we are the world's largest family-owned winery. We are the largest exporter of California wine, distributing to over 90 countries. E. & J. Gallo Winery employs an innovative and talented team made up of more than 5,000 individuals. Gallo employees contribute to the continued development and progression of the company, causing it to be a dominant force in the ever-growing wine industry. If you aspire to work among a distinguished set of individuals and thrive in a career that is part of a dynamic industry expected to double in the next ten years, envision the abundant opportunities that await you at E. & J. Gallo Winery.",,Modesto CA,"Paid, Full-time, Internship","Cal Career Fair Day 3 - 9/19/13, All Opportunities (Tech & Nontech)",E. & J. Gallo Winery,https://berkeley-csm.symplicity.com/students/?s=employers&ss=employers&mode…b6c0fb6517218aa1c9c57aed353565d6&cfc=3818f66115449b96b310baf0b989830b&sss=,,,,,Consumer Products,"E. & J. Gallo Winery arose over 75 years ago from humble beginnings by brothers Ernest and Julio Gallo. Today, we are the world's largest family-owned winery. We are the largest exporter of California wine, distributing to over 90 countries. E. & J. Gallo Winery employs an innovative and talented team made up of more than 5,000 individuals. Gallo employees contribute to the continued development and progression of the company, causing it to be a dominant force in the ever-growing wine industry. If you aspire to work among a distinguished set of individuals and thrive in a career that is part of a dynamic industry expected to double in the next ten years, envision the abundant opportunities that await you at E. & J. Gallo Winery.",,"Modesto, CA",Full-time,"Cal Career Fair Day 1 - 9/17/13, Business/Public Service Opportunities","eBay, Inc.",https://berkeley-csm.symplicity.com/students/?s=employers&ss=employers&mode…bb07fea1fa01aeb1ddde6a981c4e8f12&cfc=3818f66115449b96b310baf0b989830b&sss=,,,,,"Computer Hardware, Computer Software","eBay is the world’s leading online marketplace, bringing together a family of brands that connects communities. Built on commerce, trust, and opportunity, the unique companies that form eBay, Inc. create opportunities for people around the world—often in life-changing ways. We measure success not just on a financial scale, but on our proven ability to support social purpose and instill pride and respect amongst those who interact with us. We believe in serving community members, not customers. And our community begins here—with our people. We invite you to learn more, explore opportunities, and discover a place for you.",,"San Jose, CA",Internship,"Cal Career Fair Day 3 - 9/19/13, All Opportunities (Tech & Nontech)","eBay, Inc.",https://berkeley-csm.symplicity.com/students/?s=employers&ss=employers&mode…9d86c3887dff24051e5690e9dd11e0f2&cfc=3818f66115449b96b310baf0b989830b&sss=,,,,,Other,"eBay is the world’s leading online marketplace, bringing together a family of brands that connects communities. Built on commerce, trust, and opportunity, the unique companies that form eBay, Inc. create opportunities for people around the world—often in life-changing ways. We measure success not just on a financial scale, but on our proven ability to support social purpose and instill pride and respect amongst those who interact with us. We believe in serving community members, not customers. And our community begins here—with our people. We invite you to learn more, explore opportunities, and discover a place for you.",,United States of America,"Full-time, Internship","Cal Career Fair Day 2 - 9/18/13, Engineering/Science Opportunities",Enterprise Holdings,https://berkeley-csm.symplicity.com/students/?s=employers&ss=employers&mode…3663ce84c866a52862d5a0a884987b57&cfc=3818f66115449b96b310baf0b989830b&sss=,,,,,Other,"Enterprise Rent-A-Car is owned and operated by St. Louis-based Enterprise Holdings, a privately held company which, through its regional subsidiaries, also owns and operates the Alamo Rent A Car and National Car Rental brands. Known for exceptionally low rates and outstanding customer service, Enterprise is an internationally recognized brand with more than 6,000 neighborhood and airport locations in the United States, Canada, the U.K., Ireland, and Germany. Moreover, with more than 5,000 offices located within 15 miles of 90 percent of the U.S. population. Enterprise Rent-A-Car offers a wide variety of car leasing, van pooling, car sharing and hourly rental programs – and local car rental customers are picked up at no extra cost.","As a Management Trainee, you are empowered to make business decisions that greatly affect your career as well as the bottom line. You'll gain responsibility for developing new business and maintaining current relationships. You'll be responsible for understanding cost control, reading your branch's P&L statement and understanding what it takes to run a profitable business. You will also learn how to deliver superior customer service. We will teach you how to effectively communicate, influence and interact with all types of customers, vendors and co-workers. You'll learn proper sales techniques to problem solving and conflict management. In your development to become a successful manager at Enterprise, you'll learn how to mentor, train, develop, manage and promote a staff of your own",Nationwide,"Full-time, Internship","Cal Career Fair Day 1 - 9/17/13, Business/Public Service Opportunities",Ericsson Inc.,https://berkeley-csm.symplicity.com/students/?s=employers&ss=employers&mode…76bdb8b842c69d6c2f64161a537dbb0a&cfc=3818f66115449b96b310baf0b989830b&sss=,,,,,,,,,"Cal Career Fair Day 3 - 9/19/13, All Opportunities (Tech & Nontech)",,Exponent,https://berkeley-csm.symplicity.com/students/?s=employers&ss=employers&mode…8a5ef238af94e855f0911fb5067c44ff&cfc=3818f66115449b96b310baf0b989830b&sss=,,,,,Other,"Exponent’s multidisciplinary team of scientists, engineers, physicians, and regulatory consultants brings together more than 90 different disciplines to solve complicated problems facing corporations, insurers, government entities, associations and individuals. Our more than 900 staff members work in over 20 offices across the United States and abroad. Exponent has approximately 600 consultants, including more than 350 that have earned a doctorate in their chosen field of specialization.",,various openings,Full-time,"Cal Career Fair Day 2 - 9/18/13, Engineering/Science Opportunities",