Hilti North America,https://berkeley-csm.symplicity.com/students/?s=employers&ss=employers&mode…2c7dee44d4ff8fcf348cb206fb24af3f&cfc=3818f66115449b96b310baf0b989830b&sss=,,,,,"Materials and Construction, Engineering","Hilti is a four billion dollar Global privately held Industrial Company operating in 120 countries. We are the global leader in construction building supplies for tools and fasteners. Global Accelerated Management Program (Rotational) Hilti provides leading-edge technology to the global construction industry. Hilti products, systems and services offer the construction professional innovative solutions with outstanding added value. Over 20,000 plus employees, in more than 120 countries around the world work for Hilti in sales, marketing, engineering, finance, research, development and manufacturing. We lead the market in terms of quality, added value and innovation. The corporate culture is founded on integrity, courage, teamwork and commitment. Hilti excels through outstandin","Stages of the Program 24-36 months, 4 assignments and full responsibility from day one • Individual set-up of project assignments depending on the trainee´s skills and interests (engineering, finance, marketing, business development, logistics, HR) • Demanding projects in an international environment • Mentoring by Senior Management • Internal trainings (presentation skills, conflict-, self- and time management) The program at a glance • Areas of deployment: engineering,sales, marketing, logistics, human resources or finance & controlling • Internationality: foreign projects and international development opportunities • Coaching: personal mentor from the top management team and close contact with Human Resources • Start date: the start date is set on an individual basis •",USA All Locations,"Full-time, Internship","Cal Career Fair Day 2 - 9/18/13, Engineering/Science Opportunities",Hitachi Consulting,https://berkeley-csm.symplicity.com/students/?s=employers&ss=employers&mode…1a50a4999956fe87db7bf93d3db144c3&cfc=3818f66115449b96b310baf0b989830b&sss=,,,,,Other,"Hitachi Consulting, the global business and IT consulting arm of Hitachi, Ltd. (NYSE: HIT), provides solutions for Fortune 2000 companies across many industries. We work with our clients to understand their needs and to enable and implement key business strategies. We provide a broad range of professional services to help organizations improve their business processes and information systems. We deliver practical solutions to generate demand, ensure supply and help manage their enterprise effectively. Our professionals utilize business process, technology and financial skills to help clients create and integrate knowledge that increases their long-term value.","Hitachi Consulting is looking for team players who are enthusiastic, thrive on responsibility and inspire trust. We want colleagues who can see the big picture while executing details and who, above all, want to bring value to our clients. Our new Consultants join our Consulting Core Practice and work as team members to provide our clients with consulting services that support our solution offerings. We offer the agility of a smaller firm, the stability of larger firms, and the innovation that comes with being part of Hitachi.",San Francisco,Full-time,"Cal Career Fair Day 2 - 9/18/13, Engineering/Science Opportunities",Imerys,https://berkeley-csm.symplicity.com/students/?s=employers&ss=employers&mode…bd27799fbbc5d66b959c4459f425bda9&cfc=3818f66115449b96b310baf0b989830b&sss=,,,,,Metals and Mining,"Imerys operates 116 mining sites(1) and 29 different minerals or mineral groups. The Group draws on its knowledge of their properties and applications to mine, enrich and combine them to deliver the required effects to its customers. From deposit through to customer, find about all the key stages in Imerys’ business.",,Nationwide,"Full-time, Internship","Cal Career Fair Day 3 - 9/19/13, All Opportunities (Tech & Nontech)",IMS Consulting Group,https://berkeley-csm.symplicity.com/students/?s=employers&ss=employers&mode…1860e74e00379f2b238b82e30544ecb3&cfc=3818f66115449b96b310baf0b989830b&sss=,,,,,"Hospital/Healthcare, Other","IMS Consulting Group is the world’s leading, specialized advisor on critical business issues in the life sciences, and is the management consulting arm of IMS Health, a leading provider of information, services and technology for the healthcare industry in 100+ countries around the world. Our IMS Consulting Group teams offer end-to-end management consulting in key issues areas that include: business unit, therapy area and brand strategy, portfolio strategy, launch strategy, pricing & market access studies and commercial model design and optimization.","Analyst (Undergraduate degree) - Contributing to internal brainstorming sessions to develop project methodology/recommendations - Conducting independent desk research to a specific brief using internal/external sources - Performing quantitative/qualitative analyses to aid development of recommendations; exercise informed business judgment in identifying the approach to the question - Conducting phone or face-to-face interviews with senior managers and executives in the client team or external stakeholders Associate Consultant (Master's/PhD degree) - Conducting primary/secondary research, and analyzing research to identify key findings/learnings - Communicating strategic thoughts in a client-ready fashion - Managing projects/workstreams of reasonable size with senior support","San Francisco, CA & New York, NY",Full-time,"Cal Career Fair Day 1 - 9/17/13, Business/Public Service Opportunities",Indiegogo Inc,https://berkeley-csm.symplicity.com/students/?s=employers&ss=employers&mode…8f8d0a3105dcc1d5e21f969783f5832a&cfc=3818f66115449b96b310baf0b989830b&sss=,,,,,Other,"Our Reason For Being We’re fixing the funding process by empowering people from all over the world to accomplish extraordinary things through our platform. In 2008, we unleashed Indiegogo in the independent film industry and it was a smash hit. In 2009, we expanded to include all industries and today we’re the leading international crowdfunding platform, having raised millions of dollars for over a hundred thousand campaigns worldwide. Our belief is that anyone, anywhere who is passionate and works hard should be able to raise money. And we’re here to make it happen.",,"San Francisco, CA","Student Employment, Full-time, Summer Job, Internship","Cal Career Fair Day 2 - 9/18/13, Engineering/Science Opportunities",Iris Technology Corporation,https://berkeley-csm.symplicity.com/students/?s=employers&ss=employers&mode…ec3823071859569d70ca53bf32178131&cfc=3818f66115449b96b310baf0b989830b&sss=,,,,,"Aerospace/Defense, Electronics and Misc. Tech, Other Manufacturing, Engineering","Iris Technology is a defense contractor in Irvine, CA specializing in tactical power systems and spacecraft hardware. Founded in 1986, the company is the premier integrator of reliable tactical power systems for the military. Iris recently won a multi-year contract with the Marine Corps to deliver solar power systems for expeditionary operations. Iris also supports commercial and strategic space operations with electronics and electro-optic system components. Iris Technology can be counted on for dependable service and reliable products that promote energy independence and enhance national security. For more information, please visit: www.iristechnology.com.",Electrical Engineer Electrical Engineer Intern Mechanical Engineer Mechanical Engineer Intern Software Engineer Software Engineer Intern Information Technology Generalist,"Irvine, CA","Paid, Full-time, Internship","Cal Career Fair Day 2 - 9/18/13, Engineering/Science Opportunities",IXL Learning,https://berkeley-csm.symplicity.com/students/?s=employers&ss=employers&mode…3cef277fb1c57a4548b4ae4f7da14de8&cfc=3818f66115449b96b310baf0b989830b&sss=,,,,,,,,,"Cal Career Fair Day 3 - 9/19/13, All Opportunities (Tech & Nontech)",,JusticeCorps,https://berkeley-csm.symplicity.com/students/?s=employers&ss=employers&mode…3f7b7aeb1341714323492452ccafa110&cfc=3818f66115449b96b310baf0b989830b&sss=,,,,,Law/Law Related,"JusticeCorps is an AmeriCorps program whose members provide legal information in the areas of family law, small claims, civil harassment, landlord tenant law and restraining orders to Bay Area litigants who cannot afford attorneys. JusticeCorps members commit to serve 300 hours (one full day or two half days per week) in a Bay Area (Alameda, Santa Clara, San Francisco and San Mateo Counties) Superior Court Self Help Center over the course of the academic year. They receive over 40 hours of training and a $1,000 AmeriCorps Education Award upon the completion of their service. A limited number of full-time fellowships are also available for graduating seniors and alumni.",,"Richmond, Oakland, San Francisco, Hayward, Redwood City, Sunnyvale","Paid, Unpaid, Fellowship, Internship","Cal Career Fair Day 1 - 9/17/13, Business/Public Service Opportunities",Kaiser Permanente,https://berkeley-csm.symplicity.com/students/?s=employers&ss=employers&mode…dce0712b566a696760e5ad6608b925a4&cfc=3818f66115449b96b310baf0b989830b&sss=,,,,,Hospital/Healthcare,"CALLING ALL GO-GETTERS …trend-setters, goal-chasers, and innovation-drivers. Come get the experience you need to leap ahead of the competition. Help us shape and define the future of health care. Contribute your ideas to a place where powerful technology and business expertise come together to support lives. Do it all at Kaiser Permanente. With California-based internships and early career opportunities in IT, Sales and Marketing, Finance and Accounting, and Corporate, you’ll work on influential real-world projects that will define our success—and your own. Now is the time to tap into potential. Come accelerate your future with us. DEFINE YOUR FUTURE AND GROW WITH IT Apply your interests, talents, and passions, to one of our innovative business units.",,"California, Oregon, Colorado","Paid, Full-time, Internship","Cal Career Fair Day 1 - 9/17/13, Business/Public Service Opportunities","Kenandy, Inc.",https://berkeley-csm.symplicity.com/students/?s=employers&ss=employers&mode…4838326fc0eb831d671ef2d20a8ba30a&cfc=3818f66115449b96b310baf0b989830b&sss=,,,,,Computer Software,ERP software serviced on Force.com platform.,Force.com Software Developer Implementation Consultant Sr. Support Engineer,"Redwood City, CA",Full-time,"Cal Career Fair Day 3 - 9/19/13, All Opportunities (Tech & Nontech)",Khan Academy,https://berkeley-csm.symplicity.com/students/?s=employers&ss=employers&mode…064b7cf06eccb3e9d1b10af6624743d1&cfc=3818f66115449b96b310baf0b989830b&sss=,,,,,"Computer Software, Education/Higher Education","Khan Academy is on a mission to provide world-class education to anyone, anywhere. For more information, check out Our offerings: www.khanacademy.org/about Open positions: http://www.khanacademy.org/careers Sal's TED talk: http://www.khanacademy.org/video/salman-khan-talk-at-ted-2011--from-ted-com Economist: www.economist.com/node/21529062 WIRED: http://www.wired.com/magazine/2011/07/ff_khan/ Colbert Report: www.colbertnation.com/the-colbert-report-videos/388279/june-02-2011/salman-khan",Open positions: http://www.khanacademy.org/careers,"Mountain View, CA","Paid, Full-time, Summer Job, Internship","Cal Career Fair Day 2 - 9/18/13, Engineering/Science Opportunities",KLA-Tencor Corporation,https://berkeley-csm.symplicity.com/students/?s=employers&ss=employers&mode…b7261a5713c78e2746e96a6793709018&cfc=3818f66115449b96b310baf0b989830b&sss=,,,,,Engineering,"Ranked among the world's top ten semiconductor equipment manufacturers, KLA-Tencor offers a broad spectrum of products and services that are used by every major semiconductor manufacturer in the world, including Intel, Samsung, AMD, Texas Instruments, and Sony.",,"World Wide, Milpitas, CA","Full-time, Internship","Cal Career Fair Day 3 - 9/19/13, All Opportunities (Tech & Nontech)",Kurt Salmon,https://berkeley-csm.symplicity.com/students/?s=employers&ss=employers&mode…ad338d3d9aceae8155b20a919a5e08fd&cfc=3818f66115449b96b310baf0b989830b&sss=,,,,,Other,"Kurt Salmon is a leading global management consulting firm. We have over 75 years of history achieving lasting improvements and delivering results for our clients as thought leaders in the consulting industry. You’ll find that at Kurt Salmon we’re externally competitive but internally cooperative, creating a dynamic and engaging work environment. Kurt Salmon’s Retail and Consumer Products Group works with 30 of the world’s top 50—and all of the top five—retail and consumer products companies, companies that drive 70% of the U.S. economy. As a member of our team, you will help clients develop and implement leading product development, sourcing, merchandising, planning, supply chain and store operations practices.",,"San Francisco, New York, Atlanta","Full-time, Internship","Cal Career Fair Day 1 - 9/17/13, Business/Public Service Opportunities",L.E.K. Consulting,https://berkeley-csm.symplicity.com/students/?s=employers&ss=employers&mode…66060c372715aaa265d352a76b9bf3d3&cfc=3818f66115449b96b310baf0b989830b&sss=,,,,,Other,"L.E.K. Consulting is a global management and strategy consulting firm that uses deep industry expertise and analytical rigor to help clients solve their most critical business problems. Founded 30 years ago, L.E.K. employs over 1000 professionals in 22 offices across Europe, the Americas and Asia-Pacific. L.E.K. advises and supports global companies that are leaders in their industries – including the largest private and public sector organizations, private equity firms and emerging entrepreneurial businesses. Areas of expertise include Life Sciences, Media & Entertainment, Retail & Consumer Goods, Private Equity, Aviation & Airports (Travel & Leisure), MedTech, Healthcare Services and Building & Construction.",The focal point of an L.E.K. project team is at the Associate level. The Associate is responsible for the comprehensive research and analysis upon which each client engagement is based. Success of the team is dependent upon the quality and creativity of the analysis that Associates perform under the guidance of senior team members.,"Boston, Chicago, Los Angeles, New York City, San Francisco","Full-time, Internship","Cal Career Fair Day 1 - 9/17/13, Business/Public Service Opportunities",Lab126,https://berkeley-csm.symplicity.com/students/?s=employers&ss=employers&mode…be7cf3b8427a030a8b1ecc7bb5901ce1&cfc=3818f66115449b96b310baf0b989830b&sss=,,,,,"Computer Hardware, Computer Software, Consumer Products, Engineering","Lab126, an Amazon.com company, is an innovative consumer-focused startup company located in Cupertino, CA. We design and develop easy-to-use, highly integrated consumer products to serve Amazon customers. Our latest innovation is Amazon Kindle, a revolutionary portable reader that wirelessly downloads books, blogs, magazines and newspapers to a crisp, high-resolution electronic paper display that looks and reads like real paper, even in bright sunlight. Software Engineers Hardware Engineers Firmware Engineers Product Design Engineers Quality Assurance Engineers Technical Program Managers Internships also available in most groups.",,"Cupertino, Seattle",Full-time,"Cal Career Fair Day 2 - 9/18/13, Engineering/Science Opportunities",Lam Research,https://berkeley-csm.symplicity.com/students/?s=employers&ss=employers&mode…e3cfc51236d94d6c37ce04686fc970a3&cfc=3818f66115449b96b310baf0b989830b&sss=,,,,,"Electronics and Misc. Tech, Other Manufacturing, Engineering","Lam Research Corporation is a leading supplier of wafer fabrication equipment and services to the worldwide semiconductor industry, where we have been advancing semiconductor manufacturing for over 30 years. Lam offers a broad portfolio of market-leading, complementary products for plasma etch, thin film deposition, photoresist strip, and single-wafer clean. With corporate headquarters located in Fremont, California, Lam maintains a network of facilities throughout North America, Europe, and Asia. Our values-based culture creates a fast-paced environment that fosters creativity, offers opportunity, and recognizes and rewards achievement.",,Various,"Full-time, Internship","Cal Career Fair Day 2 - 9/18/13, Engineering/Science Opportunities",Lightning Bolt Solutions,https://berkeley-csm.symplicity.com/students/?s=employers&ss=employers&mode…72079bf75a90ddb912d0f38cab5b2690&cfc=3818f66115449b96b310baf0b989830b&sss=,,,,,"Computer Software, Hospital/Healthcare","Lightning Bolt Solutions is a growing, profitable start-up that offers web-based software solutions for healthcare staff scheduling using cutting edge Artificial Intelligence and Operations Research methodologies.","Software Developer Internships We're looking for a motivated interns to support the design and development of the user interface for our next generation automated scheduling system. You'll work with senior engineers to help brainstorm, prototype, and implement new ideas. Ideally, you have interest in or have already worked on web app projects that look and work great. 10-20 hours per week (includes at least 1 day in the office and remote work, flexible to your schedule) 6 month or 1 year internship option Paid internship Who we're looking for: BS or MS students majoring in Computer Science (transcripts to be requested). Some working knowledge with Ruby on Rails, databases (MySQL/SQL Server), and scripting (JavaScript, jQuery, CSS, HTML/HTML5 is a huge plus!)","Burlingame, CA","Paid, Internship","Cal Career Fair Day 3 - 9/19/13, All Opportunities (Tech & Nontech)",LinkedIn,https://berkeley-csm.symplicity.com/students/?s=employers&ss=employers&mode…30d0798e29bf766bc96c320b4c3e0936&cfc=3818f66115449b96b310baf0b989830b&sss=,,,,,Computer Software,"Your professional network of trusted contacts gives you an advantage in your career, and is one of your most valuable assets. LinkedIn exists to help you make better use of your professional network and help the people you trust in return. Our mission is to connect the world’s professionals to accelerate their success. We believe that in a global connected economy, your success as a professional and your competitiveness as a company depends upon faster access to insight and resources you can trust. LinkedIn is an interconnected network of experienced professionals from around the world, representing 170 industries and 200 countries. You can find, be introduced to, and collaborate with qualified professionals that you need to work with to accomplish your goals.",,"Mountain View, CA",Full-time,"Cal Career Fair Day 1 - 9/17/13, Business/Public Service Opportunities","LitiNomics, Inc.",https://berkeley-csm.symplicity.com/students/?s=employers&ss=employers&mode…acb117483ef85ea5bf9b0092b1b1ef1e&cfc=3818f66115449b96b310baf0b989830b&sss=,,,,,"Professional, Technical, and Administrative Services, Law/Law Related","LitiNomics is a consulting firm of professionals dedicated to addressing the economic and financial issues that arise in complex commercial litigation. We have an innovative and entrepreneurial culture that helps us solve the sophisticated challenges facing our clients. Our focus is primarily damages quantification and expert testimony, with a specialization in Intellectual Property litigation.",,"Mountain View, CA; Oakland, CA; Los Angeles, CA",Full-time,"Cal Career Fair Day 1 - 9/17/13, Business/Public Service Opportunities",Magoosh,https://berkeley-csm.symplicity.com/students/?s=employers&ss=employers&mode…7146fed3ef62d8e155f47c33bbc30b8c&cfc=3818f66115449b96b310baf0b989830b&sss=,,,,,,,,,"Cal Career Fair Day 3 - 9/19/13, All Opportunities (Tech & Nontech)",,"Malabs, Inc",https://berkeley-csm.symplicity.com/students/?s=employers&ss=employers&mode…f2db544c9e3f712a17291adef95944e6&cfc=3818f66115449b96b310baf0b989830b&sss=,,,,,"Computer Hardware, Electronics and Misc. Tech","Founded in 1983, Ma Labs is one of the leading computer component distributors in the United States. The company specializes in memory modules and also distributes CPUs, storage products, motherboards, multimedia products, communication products, video graphic cards, notebooks and Microsoft products. We have over 5,000 hardware and software products in stock. Our more than three hundred sales, engineering and customer service employees are here to serve you from the company's 125,000 square-foot facility in the heart of Silicon Valley--San Jose, California.","Account Manager • New business prospecting and development; including develop new customers on domestic or international basis.• Generating new customer and sales leads, setting-up accounts and controlling credit limits;• Develop relationships and maintain continuous contact with existing customers, getting existing customers’ feedbacks and assisting with resolution of customer issues or complains;• Suggesting and promoting products to customers, working with manufacturers and Product Mangers to promote PC components and systems, and to improve the market share and generate the large amount of the business, as well as participate in the trade shows for promoting new products;• Quoting and negotiating price with customers, negotiate price through PM with manufacturers, and customers","San Jose, CA",Full-time,"Cal Career Fair Day 1 - 9/17/13, Business/Public Service Opportunities",Marin Software,https://berkeley-csm.symplicity.com/students/?s=employers&ss=employers&mode…252627f249e6982062ee10451baac312&cfc=3818f66115449b96b310baf0b989830b&sss=,,,,,Computer Software,"Marin provides a leading revenue acquisition management platform used by advertisers and agencies to manage more than $4 billion in annualized ad spend. Offering an integrated platform for search, social, display, and mobile advertising, Marin helps advertisers and agencies improve financial performance, save time, and make better decisions. Headquartered in San Francisco, with offices worldwide, Marin's technology powers marketing campaigns in more than 160 countries. For more information about Marin’s products, please visit: http://www.marinsoftware.com/solutions/overview. Marin's common stock trades on the New York Stock Exchange under the symbol MRIN.","Software Engineer and Software Engineer Internship ENGINEERING | SAN FRANCISCO, CA AND PORTLAND, OR Marin Software Engineers are passionate about designing quality code through a collaborative process. We enjoy intense mathematics and computer science challenges and approach these problems with creativity and teamwork. We believe Marin's explosive growth should not compromise its agility in responding to market trends. We are a company that believes in building a product for the long-term, and creating a company that can grow as the market matures.","San Francisco, CA and Portland, OR","Full-time, Internship","Cal Career Fair Day 2 - 9/18/13, Engineering/Science Opportunities",Maxim Integrated,https://berkeley-csm.symplicity.com/students/?s=employers&ss=employers&mode…68ceee5f6ac5ff86eb1f3c33ce471609&cfc=3818f66115449b96b310baf0b989830b&sss=,,,,,Engineering,"Maxim Integrated is a highly successful, $2.4 billion company. With offices and manufacturing sites around the world, we design award-winning semiconductors that make the world more integrated. We also know that it’s our people who make us a great company. So we reward bold thinking, teamwork, personal growth, and community involvement. Want to make a difference and be challenged every day? Join us at Maxim Integrated. With analog integration, the possibilities are endless.","Maxim Integrated is hiring for 40+ Full-Time Engineering positions, and 60+ Engineering Internships. Stop by our booth to learn about opportunities with Maxim, or visit our Careers site for more information. We look forward to seeing you there! http://www.maximintegrated.com/company/careers/career-opportunities/",Nationwide,"Paid, Full-time, Internship","Cal Career Fair Day 2 - 9/18/13, Engineering/Science Opportunities","Medallia, Inc.",https://berkeley-csm.symplicity.com/students/?s=employers&ss=employers&mode…389520270c86b432dfbb2a0005726315&cfc=3818f66115449b96b310baf0b989830b&sss=,,,,,Computer Software,"Medallia, the global leader in SaaS-based Customer Experience Management (CEM), was founded on a simple idea—help companies win in the marketplace by excelling with the ultimate judges: customers. Named Leader in our category by Forrester in its first-ever Wave report on the industry, Medallia is the customer feedback engine for the world’s most admired brands. Our customer satisfaction rate is unparalleled in the enterprise software space. We recently closed our first-ever funding with a top VC to increase our already-high growth rate and accelerate our pace to IPO.",,"Palo Alto, CA","Paid, Full-time, Internship","Cal Career Fair Day 3 - 9/19/13, All Opportunities (Tech & Nontech)",