Protiviti,https://berkeley-csm.symplicity.com/students/?s=employers&ss=employers&mode…7433f219bcb3631fcb095c940acafce3&cfc=3818f66115449b96b310baf0b989830b&sss=,,,,,"Professional, Technical, and Administrative Services","Protiviti is a global consulting firm that helps companies solve problems in finance, technology, operations, governance, risk and internal audit. Through our network of more than 70 offices in over 20 countries, we have served more than 35% of the FORTUNE® 1000 and Global 500 companies. We also work with smaller, growing companies, including those looking to go public, as well as with government agencies. Protiviti’s highly trained, results-oriented professionals provide a unique perspective on a wide range of critical business issues. But we’re more than just consultants. We’re problem solvers. Protiviti has more than 60 locations worldwide and is a wholly owned subsidiary of Robert Half International Inc. (NYSE symbol: RHI).","Technology Consultants & Interns work in dynamic, team-oriented environments where they define technology system or process issues, compile information and analyze data in order to present solutions to our clients. Protiviti assists clients in selecting new software, assessing the performance of existing applications and managing their application control environment. Our Process Consultants and Interns define internal business process issues, compile information and analyze data in order to present solutions to our clients. Protiviti works with audit executives, management and audit committees to assist them with their internal audit activities. We help CFOs strengthen their finance functions through improved financial and reporting processes.",Bay Area,"Full-time, Internship","Cal Career Fair Day 1 - 9/17/13, Business/Public Service Opportunities",Prudential Financial,https://berkeley-csm.symplicity.com/students/?s=employers&ss=employers&mode…ad41c984036b5db106907a8e4c8a8b2a&cfc=3818f66115449b96b310baf0b989830b&sss=,,,,,Financial Services,"Prudential Financial companies serve individual and institutional customers worldwide and include The Prudential Insurance Company of America, one of the largest life insurance companies in the U.S. These companies offer a variety of products and services, including life insurance, property and casualty insurance, mutual funds, annuities, pension and retirement related services and administration, asset management, banking and trust services, real estate brokerage franchises, and relocation services. Prudential Financial's Common Stock (NYSE:PRU) reflects the performance of its Financial Services Businesses, which consist of its Insurance, Investment, and International Insurance and Investments divisions and its Corporate and Other operations.",,Multiple Locations,Full-time,"Cal Career Fair Day 1 - 9/17/13, Business/Public Service Opportunities",QuinStreet,https://berkeley-csm.symplicity.com/students/?s=employers&ss=employers&mode…87f87aa5388f3dfdd9de058e18f60d53&cfc=3818f66115449b96b310baf0b989830b&sss=,,,,,Media,"QuinStreet serves clients and consumers in large, information-intensive industry verticals where relevant, targeted media and offerings help visitors make informed choices and find products and services that match their needs. Currently, primary client verticals are the education and financial services industries. We also have a presence in the home services, B2B, medical and health industries. Thousands of industry-leading consumer and business brands have benefited from our qualified inquiries since 1999.",,"Foster City, Ca","Paid, Full-time, Internship","Cal Career Fair Day 1 - 9/17/13, Business/Public Service Opportunities",Rackspace,https://berkeley-csm.symplicity.com/students/?s=employers&ss=employers&mode…0bce41ce574a74847422ceca12ae1f9d&cfc=3818f66115449b96b310baf0b989830b&sss=,,,,,"Computer Hardware, Computer Software, Engineering","Fanatical Support® has made Rackspace the service leader in cloud computing. We deliver enterprise-level hosting services to businesses of all sizes and kinds around the world. We got started in 1998 and since have grown to serve more than 197,000 customers. Rackspace integrates the industry's best technologies for each customer's specific need and delivers it as a service via the company's commitment to Fanatical Support. Our core products include Managed Hosting, Cloud Hosting and Email & Apps. There are currently over 5,300 Rackers around the world serving our customers.",,"San Francisco, CA; San Antonio, TX; Austin, TX; Blacksburg, VA; Suwanee, GA","Paid, Student Employment, Full-time, Internship","Cal Career Fair Day 2 - 9/18/13, Engineering/Science Opportunities",RAININ,https://berkeley-csm.symplicity.com/students/?s=employers&ss=employers&mode…89143a5e26e4b0d7e1aa464127ac1f9f&cfc=3818f66115449b96b310baf0b989830b&sss=,,,,,Biotech/Pharmaceuticals,"Rainin is a manufacturer and distributor of pipettes and pipette products, as well as other types of laboratory instruments and supplies. Our related, complementary product lines are sold to scientists and technicians in universities, research institutions and the pharmaceutical, biotechnology and chemical industries. Rainin places a strong emphasis on customer satisfaction and on the quality of the products and services it provides to its customers. Rainin is committed to constantly improving the level of customer satisfaction as well as the quality of its products and services. Inside Sales Representative Job Description","Inside Sales Representative The main focus of this position is to increase sales of Rainin products and services within an assigned market space by cross-selling current customers and generating opportunities in new and existing accounts. While much of this selling is done over the phone, this position also requires travel in the field for 15% - 20% of the time calling on key customers or attending vendor shows or conventions. The incumbent will generate leads from a variety of sources, such as internal databases, segment market studies, internet, the purchase of external databases, etc. Ancillary tasks include completing and timely follow-through on internally generated sales initiatives as well as accurately recording results and generating reports for management.","Oakland, CA","Paid, Full-time","Cal Career Fair Day 3 - 9/19/13, All Opportunities (Tech & Nontech)","Raybeam, Inc.",https://berkeley-csm.symplicity.com/students/?s=employers&ss=employers&mode…df84f985b09c76b32c71cb0961937487&cfc=3818f66115449b96b310baf0b989830b&sss=,,,,,"Computer Software, Engineering","Raybeam Inc. is a dynamic technology consulting company focused on strategic consulting, business intelligence, and online/database marketing for the past fifteen years. We have offices near Boston and in Silicon Valley and support a strong list of clients including Google, Facebook, Microsoft, eBay, AOL/Time Warner, and Hilton Worldwide. We seek a flexible, well-rounded technologist with maturity and business savvy to join us. We design and develop systems using a variety of tools and platforms. We work in small teams, own the projects that we work on, and have direct input into the business decisions of our clients.","What are we looking for? We seek a flexible, well-rounded software engineer with confidence and business savvy to join us. What we’d like to see in you: • Breadth of knowledge- We move fast on small teams with a variety of technologies • Excellent communication skills- Be able to explain what you are doing and why to your teammates and to the client • Adaptability– You need to work with new technologies or deal with challenging situations • Problem Solving– You need to solve problems under pressure and adapt to new situations Experience or proficiency in several of the following is expected: • Database Management Systems-e.g. Oracle, MS SQL, mySQL • Operating Systems-e.g. Linux, Windows and MacOS • Scripting languages-e.g. Ruby, Python • Compiled languages-e.g. C#, Java, C++","Mountain View, CA",Full-time,"Cal Career Fair Day 3 - 9/19/13, All Opportunities (Tech & Nontech)",Redfin,https://berkeley-csm.symplicity.com/students/?s=employers&ss=employers&mode…08ffa40ed64068da426e594b11b3fc13&cfc=3818f66115449b96b310baf0b989830b&sss=,,,,,Real Estate,We believe that technology can improve the way people buy and sell homes. Redfin.com was crafted by an expert team of engineers who are passionate about user experience and we use the latest technologies to help our customers find their dream homes.,,"San Francisco, CA","Full-time, Internship","Cal Career Fair Day 2 - 9/18/13, Engineering/Science Opportunities",Reputation.com,https://berkeley-csm.symplicity.com/students/?s=employers&ss=employers&mode…1fb37ddad05ceaaada91dbf6d57b02da&cfc=3818f66115449b96b310baf0b989830b&sss=,,,,,Computer Software,"Reputation.com® is the world’s leading provider of online reputation products and services. We have thousands of users from 100+ countries around the world. We’ve been featured in over 400 leading publications globally including; The New York Times, The Wall Street Journal and Economist. We’re funded by the same top tier venture capital firms that funded Google, Microsoft, Amazon.com and Intel. We’ve assembled a world–class team of engineers, researchers, and an award–winning customer service team here in Redwood City, California. Our patented technology helps you understand your online reputation and gives you the tools to monitor, manage and secure your information on the Internet. We believe you should control your online reputation and private data. Let us help you take control.","We're seeking a front end software engineer to push our user experience forward. In collaboration with product managers and team lead, our front end software engineers work to deliver data to the browser and capture user interaction in a compelling, intelligent, and efficient manner. Front end engineers extend the functionality of our products and work to eliminate deficiencies in the current release. What we are looking for: You love to use JavaScript frameworks like jQuery, Backbone, and Mustache. You like to take responsibility and roll up your sleeves and get it done. You like building simple, reusable, fast, and elegant software. You like working in a fast-paced, agile environment with aggressive release schedule.",Redwood City,"Paid, Full-time, Summer Job, Internship","Cal Career Fair Day 2 - 9/18/13, Engineering/Science Opportunities",Riviera Partners,https://berkeley-csm.symplicity.com/students/?s=employers&ss=employers&mode…d975cb2ac655fdc45c13fa9e78da244a&cfc=3818f66115449b96b310baf0b989830b&sss=,,,,,Other,Riviera Partners is a leading provider for technical search and recruiting services. Rated as the 1253 fastest growing company in America Riviera Partners is the premier management consulting firms.,,"San Francisco, California",Full-time,"Cal Career Fair Day 3 - 9/19/13, All Opportunities (Tech & Nontech)","Ross Stores, Inc",https://berkeley-csm.symplicity.com/students/?s=employers&ss=employers&mode…e9481d70e3ddcda1c7a4ac2d24eb637b&cfc=3818f66115449b96b310baf0b989830b&sss=,,,,,Retail and Wholesale Trade,"Ross Stores, Inc. is an S&P 500, Fortune 500 and NASDAQ 100 (ROST) Company headquartered in Pleasanton, California, with fiscal 2012 revenues of $9.7 billion. The Company operates Ross Dress for Less® (“Ross”), the largest off-price apparel and home fashion chain in the United States with 1,091 locations in 33 states, the District of Columbia and Guam. Ross offers first-quality, in-season, name brand and designer apparel, accessories, footwear and home fashions for the entire family at everyday savings of 20% to 60% off department and specialty store regular prices. The Company also operates 108 dd’s DISCOUNTS® in eight states that feature a more moderately-priced assortment of first-quality, in-season, name brand apparel, accessories, footwear and home fashions.","The Assistant Store Manager (ASM) is responsible for management and supervision of all assigned departments and all non-exempt employees. The ASM will assists in managing and controlling the operations of the store to ensure that company standards and expectations are consistently met. Additionally, the ASM will supervise areas assigned by the Store Manager and follow the Ross philosophy and policies in regard to customers, Associates and merchandising. The ASM is responsible for learning all phases of store operations. In the absence of the Store Manager, the Assistant Manager is responsible for the entire store operation and will execute the business plan and associated programs that will deliver the desired sales and profit results, while maintaining good quality customer service.",San Francisco/ Bay Area,Full-time,"Cal Career Fair Day 1 - 9/17/13, Business/Public Service Opportunities",Rothstein Kass,https://berkeley-csm.symplicity.com/students/?s=employers&ss=employers&mode…2fbd6dcac0febb6a33fbf03535654f7a&cfc=3818f66115449b96b310baf0b989830b&sss=,,,,,"Accounting Services, Financial Services","Rothstein Kass is a premier professional services firm that has served privately held and publicly traded companies, as well as high-net-worth individuals and families, for more than 50 years. As trusted advisors to our clients, Rothstein Kass provides accounting, auditing and tax services, as well as a full array of integrated services, to clients across industry spectrums and in all stages of organizational development. At the core of Rothstein Kass’ remarkable success lies our commitment to hiring, developing and retaining employees that represent an entrepreneurial spirit mirroring that of the sophisticated business and financial services communities that we serve.","Audit Associate: As an associate in our audit team you will be exposed to all aspects of an audit engagement. Working on multiple clients and with a variety of people at various levels throughout our firm, you will be provided with challenging work and the opportunity to grow as a professional. Tax Associate: As an associate with our tax team you will be given the opportunity to work on various types of tax returns. This will help you determine which area of tax you enjoy the most. You will be exposed to Individual, Partnership, Corporate returns and well as many other aspects of Taxation. Education: Bachelor’s degree or MS in accounting or Bachelor’s degree plus all required courses to sit for the CPA exam Skills: • Excel skills • Excellent communication skills",Walnut Creek/San Francisco,Full-time,"Cal Career Fair Day 1 - 9/17/13, Business/Public Service Opportunities",Safeway Inc.,https://berkeley-csm.symplicity.com/students/?s=employers&ss=employers&mode…677233db6d1cdab9360b0147fbe84f53&cfc=3818f66115449b96b310baf0b989830b&sss=,,,,,Retail and Wholesale Trade,"Safeway Inc., a Fortune 100 Company, is one of the largest food and drug retailers in North America with 1,600+ stores. The Safeway family of brands includes some of the most prominent brands in food retailing, with a growing base of loyal shoppers. Thanks to the professionalism, diversity, spirit and friendliness of our people, we have locations across the U.S. and Canada. Diversity is fundamental at Safeway. We foster an inclusive working environment where the different strengths and perspectives of each employee is both recognized and valued. We believe that building successful relationships with our customers and our communities is only possible through the diversity of our people. And a diverse workforce leads to better teamwork and creative thinking, as well as mutual respect.","Each summer we open our corporate doors to college juniors and seniors. It's an opportunity for students to get a taste of the challenging, fast-paced retail industry at our corporate headquarters in Pleasanton, California. The 9-12 week paid Summer Internship Program runs from mid June through mid August. Safeway Corporate Interns partner with management teams, and are assigned to business division specific projects. Interns work side by side with corporate colleagues contributing relevant work product and gaining hands on experience. Interns also receive an interactive overview of the corporation via assignments, executive presentations, a group volunteer day at a local non-profit organization and business site tours to a Safeway manufacturing, distribution and culinary center.","Pleasanton, CA",Internship,"Cal Career Fair Day 1 - 9/17/13, Business/Public Service Opportunities",Salesforce.com,https://berkeley-csm.symplicity.com/students/?s=employers&ss=employers&mode…4c2621ee9839b5776ae0383ea3d86381&cfc=3818f66115449b96b310baf0b989830b&sss=,,,,,Computer Software,"Salesforce.com is the world’s largest provider of customer relationship management (CRM) software. We pioneered the shift to enterprise cloud computing, and today we’re #1 across our core product lines – Sales Cloud, Service Cloud, Marketing Cloud and Salesforce Platform. Our social and mobile cloud technologies _help companies connect with their customers, partners, employees and products in entirely new ways. We are the fastest growing of the world’s top 10 enterprise software companies, the World’s Most Innovative Company according to Forbes and one of Fortune’s Best Companies to Work For five years in a row. Our more human, less corporate culture creates a #dreamjob experience for our employees working in locations around the world. Interested? Learn more at www.salesforce.com/dreamjob","Marketing, Sales, and Finance opportunities","San Francisco, CA","Paid, Full-time, Summer Job, Internship","Cal Career Fair Day 1 - 9/17/13, Business/Public Service Opportunities",Sandia National Laboratories,https://berkeley-csm.symplicity.com/students/?s=employers&ss=employers&mode…de4aeaaafaa2c757a2b854ce2b15577c&cfc=3818f66115449b96b310baf0b989830b&sss=,,,,,Government,"Sandia National Laboratories is the nation's premier science and engineering lab for national security and technology innovation. We are a world-class team of scientists, engineers, technologists, post docs, and visiting researchers all focused on cutting-edge technology, ranging from homeland defense, global security, biotechnology, and environmental preservation to energy and combustion research, computer security, and nuclear defense. To learn more, visit California Website: http://ca.sandia.gov/casite/ or New Mexico Website: http://www.sandia.gov/.","Electrical Engineers, Mechanical Engineers, Computer Science, Physics, Materials Science, Systems Engineers","Livermore, CA and Albuquerque, NM","Paid, Fellowship, Student Employment, Full-time, Internship","Cal Career Fair Day 2 - 9/18/13, Engineering/Science Opportunities",Schlumberger,https://berkeley-csm.symplicity.com/students/?s=employers&ss=employers&mode…abe98a2ede2b51f7a6dbe4685a3e448e&cfc=3818f66115449b96b310baf0b989830b&sss=,,,,,Energy,"Schlumberger is the world’s leading supplier of technology, integrated project management and information solutions to customers working in the oil and gas industry worldwide. Employing more than 120,000 people representing over 140 nationalities and working in approximately 85 countries, Schlumberger provides the industry’s widest range of products and services from exploration through production. This year, the company is recruiting more than 5,000 graduates in: Engineering, Science, Geoscience, Business and Finance, and HSE. Schlumberger Limited has principal offices in Paris, Houston and The Hague, and reported revenues of $42.15 billion in 2012.","Research, Engineering, Manufacturing, and Sustaining Engineers and Scientists (job id: 6663)",Nationwide,"Paid, Full-time, Internship","Cal Career Fair Day 2 - 9/18/13, Engineering/Science Opportunities",Sequoia Capital,https://berkeley-csm.symplicity.com/students/?s=employers&ss=employers&mode…dd529d54a360c5839fcbef946d271be7&cfc=3818f66115449b96b310baf0b989830b&sss=,,,,,"Computer Software, Other","Venture capital firm Sequoia Capital specializes in seed, early, and growth stage investments across internet, technology, mobile, energy, financial, and healthcare sectors. Past and current companies include Google, PayPal, YouTube, Dropbox, Square, Airbnb and Evernote to name a few. We are now accepting applications for all our portfolio companies across all industries and functions. Apply just once to be connected to all of our startups.","Software Engineer – Interns & New Grads Designers - Interns & New Grads Apply once to be considered for a job at all Sequoia Capital portfolio companies. Our current investment portfolio includes well-know startups such as AirBnB, Square, 10Gen and Dropbox, as well as future heavyweights like Stripe, Humble Bundle and Cue. These portfolio companies, and many more, are all looking to add talented engineers & designers to their stellar teams, and as an early investor in all, we will connect you with the role that best fits your skills and technical interests with just this one application. Of course, before we get that far you’ll need to demonstrate you are up for the challenge, but for those that are, an awesome startup career awaits.","Bay Area, NYC, Boston","Full-time, Internship","Cal Career Fair Day 2 - 9/18/13, Engineering/Science Opportunities",SHAMROCK REAL ESTATE CO,https://berkeley-csm.symplicity.com/students/?s=employers&ss=employers&mode…6d1a65a1c0375b68a786ea25f40fe7e4&cfc=3818f66115449b96b310baf0b989830b&sss=,,,,,Real Estate,"Shamrock Real Estate Company is a family-owned real estate sales company with a demonstrated commitment to excellent customer service and a reputation for thorough and reliable market knowledge. Shamrock prides itself on excellent service to all its clients. Our highly experienced agents handle the purchase and sale of all types of property throughout San Francisco and the Peninsula, including multifamily, commercial buildings, NNN properties, land for development or renovation, single-family homes, condos, and TICs","Sales Associate/ Training Provided: Shamrock Real Estate Company is offering multi-family sales training that emphasizes obtaining listings. The company focuses on multi-family, land, 1031 tax-deferred exchanges, NNN investments and new construction sales. We offer training and individual attention in launching or refocusing a career in real estate sales. Candidates must be competitive, determined and self-motivated. Other important qualities include: resiliency, honesty, integrity, and strong interpersonal skills. A Bachelor’s Degree and Sales experience is preferred but not necessary. Internship: Internship would be four hours per week.","San Francisco, CA","Full-time, Internship","Cal Career Fair Day 3 - 9/19/13, All Opportunities (Tech & Nontech)",Snapchat,https://berkeley-csm.symplicity.com/students/?s=employers&ss=employers&mode…88da8e431161567ce2596cd7938d88ae&cfc=3818f66115449b96b310baf0b989830b&sss=,,,,,Other,"Snapchat is a new way to share moments with friends. Snap an ugly selfie or a video, add a caption, and send it to a friend (or maybe a few). They'll receive it, laugh, and then the snap disappears. The image might be a little grainy, and you may not look your best, but that's the point. It's about the moment, a connection between friends, and not just a pretty picture. The allure of fleeting messages reminds us about the beauty of friendship - we don't need a reason to stay in touch.","We are a passionate team working hard to help people share authentic moments with friends. We have tons of interesting technical challenges, including architecting and deploying infrastructure to handle our scale, designing a secure mobile client, and maintaining an application that sees millions of users and billions of requests per day, just to name a few. Our engineers: Evaluate the technical tradeoffs of every decision Code review and care about code quality Build robust, lasting, and scalable products Collaborate and are willing to learn Ideal candidates: Have launched their own product before Get excited by tough technical challenges Love learning","Venice, CA","Paid, Full-time, Summer Job, Internship","Cal Career Fair Day 2 - 9/18/13, Engineering/Science Opportunities",Sony,https://berkeley-csm.symplicity.com/students/?s=employers&ss=employers&mode…77b143d585475269a40b5fe99cca6f01&cfc=3818f66115449b96b310baf0b989830b&sss=,,,,,"Biotech/Pharmaceuticals, Computer Software, Engineering","Sony is a leading manufacturer of audio, video, communications, and information technology products for the consumer and professional markets. Its music, motion picture, television, computer entertainment, and online businesses make Sony one of the most comprehensive entertainment companies in the world. One of Sony's key new business fields is the medical business. Sony aims to achieve mid- to long-term growth in its medical business, and will strive to expand and strengthen its range of flow cytometers to deliver high-quality, innovative products.",,"San Jose, CA","Paid, Full-time","Cal Career Fair Day 2 - 9/18/13, Engineering/Science Opportunities",